{
  "id": "https://w3id.org/ogc/hosted/seadots/catalog/application/reef-effect",
  "type": "Feature",
  "itemType": "record",
  "conformsTo": [
    "https://docs.ogc.org/is/20-004/20-004.html"
  ],
  "geometry": null,
  "bbox": [

  ],
  "properties": {
    "title": "Utsira reef-effect biomass application",
    "description": "Reusable application record for estimating reef-associated biomass around floating wind infrastructure.",
    "type": "Application",
    "applicationCategory": "DigitalTwinApplication",
    "softwareVersion": "0.1.0",
    "programmingLanguage": "Python",
    "applicationPackage": "https://w3id.org/ogc/hosted/seadots/catalog/application-package/reef-effect",
    "workflow": "https://w3id.org/ogc/hosted/seadots/catalog/workflow/reef-effect",
    "inputs": [
      {
        "profileId": "ogc.hosted.seadots.catalog-input",
        "required": true,
        "role": "catalog-input",
        "description": "Generic STAC input item accepted by this application."
      },
      {
        "profileId": "ogc.hosted.seadots.area-of-interest",
        "required": true,
        "role": "area-of-interest",
        "description": "GeoJSON Feature defining the spatial area for the calculation."
      },
      {
        "profileId": "ogc.hosted.seadots.benthic-biomass-density-mareano",
        "required": false,
        "role": "benthic-biomass-density",
        "description": "Optional baseline benthic biomass-density input profile."
      }
    ],
    "outputs": [
      {
        "profileId": "ogc.hosted.seadots.catalog-output",
        "required": true,
        "role": "catalog-output",
        "description": "Generic STAC output item produced by this application."
      },
      {
        "profileId": "ogc.hosted.seadots.reef-effect-output",
        "required": true,
        "role": "reef-biomass-result",
        "description": "Structured reef-effect biomass output record."
      }
    ],
    "keywords": [
      "open-science",
      "digital-twin",
      "offshore-wind"
    ],
    "license": "https://creativecommons.org/licenses/by/4.0/"
  },
  "links": [
    {
      "rel": "describedby",
      "href": "bblocks://ogc.hosted.seadots.catalog-application",
      "type": "application/schema+json"
    },
    {
      "rel": "application-package",
      "href": "https://w3id.org/ogc/hosted/seadots/catalog/application-package/reef-effect",
      "type": "application/json"
    },
    {
      "rel": "workflow",
      "href": "https://w3id.org/ogc/hosted/seadots/catalog/workflow/reef-effect",
      "type": "application/json"
    }
  ]
}
